[
  {
    "id": "60000001-0000-4000-8000-000000000001",
    "siteId": "11111111-1111-4111-8111-111111111111",
    "code": "LOT-2026-001",
    "productType": "vin",
    "variety": "Douce Moen",
    "harvestYear": 2026,
    "status": "in_progress",
    "volumeLiters": 4500,
    "origin": "Parcelle demo 1",
    "createdAt": "2026-05-18T09:00:00.000Z",
    "updatedAt": "2026-05-18T09:00:00.000Z"
  },
  {
    "id": "60000002-0000-4000-8000-000000000002",
    "siteId": "11111111-1111-4111-8111-111111111111",
    "code": "LOT-2026-002",
    "productType": "cidre",
    "variety": "Avrolles",
    "harvestYear": 2026,
    "status": "maturing",
    "volumeLiters": 5150,
    "origin": "Parcelle demo 2",
    "createdAt": "2026-05-18T09:00:00.000Z",
    "updatedAt": "2026-05-18T09:00:00.000Z"
  },
  {
    "id": "60000003-0000-4000-8000-000000000003",
    "siteId": "11111111-1111-4111-8111-111111111111",
    "code": "LOT-2026-003",
    "productType": "cidre",
    "variety": "Guillevic",
    "harvestYear": 2026,
    "status": "maturing",
    "volumeLiters": 5800,
    "origin": "Parcelle demo 3",
    "createdAt": "2026-05-18T09:00:00.000Z",
    "updatedAt": "2026-05-18T09:00:00.000Z"
  },
  {
    "id": "60000004-0000-4000-8000-000000000004",
    "siteId": "11111111-1111-4111-8111-111111111111",
    "code": "LOT-2026-004",
    "productType": "vin",
    "variety": "Chardonnay",
    "harvestYear": 2026,
    "status": "maturing",
    "volumeLiters": 6450,
    "origin": "Parcelle demo 4",
    "createdAt": "2026-05-18T09:00:00.000Z",
    "updatedAt": "2026-05-18T09:00:00.000Z"
  },
  {
    "id": "60000005-0000-4000-8000-000000000005",
    "siteId": "11111111-1111-4111-8111-111111111111",
    "code": "LOT-2026-005",
    "productType": "cidre",
    "variety": "Douce Moen",
    "harvestYear": 2026,
    "status": "in_progress",
    "volumeLiters": 7100,
    "origin": "Parcelle demo 5",
    "createdAt": "2026-05-18T09:00:00.000Z",
    "updatedAt": "2026-05-18T09:00:00.000Z"
  },
  {
    "id": "60000006-0000-4000-8000-000000000006",
    "siteId": "11111111-1111-4111-8111-111111111111",
    "code": "LOT-2026-006",
    "productType": "cidre",
    "variety": "Avrolles",
    "harvestYear": 2026,
    "status": "maturing",
    "volumeLiters": 7750,
    "origin": "Parcelle demo 6",
    "createdAt": "2026-05-18T09:00:00.000Z",
    "updatedAt": "2026-05-18T09:00:00.000Z"
  },
  {
    "id": "60000007-0000-4000-8000-000000000007",
    "siteId": "11111111-1111-4111-8111-111111111111",
    "code": "LOT-2026-007",
    "productType": "vin",
    "variety": "Guillevic",
    "harvestYear": 2026,
    "status": "maturing",
    "volumeLiters": 8400,
    "origin": "Parcelle demo 7",
    "createdAt": "2026-05-18T09:00:00.000Z",
    "updatedAt": "2026-05-18T09:00:00.000Z"
  },
  {
    "id": "60000008-0000-4000-8000-000000000008",
    "siteId": "11111111-1111-4111-8111-111111111111",
    "code": "LOT-2026-008",
    "productType": "cidre",
    "variety": "Chardonnay",
    "harvestYear": 2026,
    "status": "maturing",
    "volumeLiters": 9050,
    "origin": "Parcelle demo 8",
    "createdAt": "2026-05-18T09:00:00.000Z",
    "updatedAt": "2026-05-18T09:00:00.000Z"
  },
  {
    "id": "60000009-0000-4000-8000-000000000009",
    "siteId": "22222222-2222-4222-8222-222222222222",
    "code": "LOT-2026-009",
    "productType": "cidre",
    "variety": "Douce Moen",
    "harvestYear": 2026,
    "status": "in_progress",
    "volumeLiters": 9700,
    "origin": "Parcelle demo 9",
    "createdAt": "2026-05-18T09:00:00.000Z",
    "updatedAt": "2026-05-18T09:00:00.000Z"
  },
  {
    "id": "60000010-0000-4000-8000-000000000010",
    "siteId": "22222222-2222-4222-8222-222222222222",
    "code": "LOT-2026-010",
    "productType": "vin",
    "variety": "Avrolles",
    "harvestYear": 2026,
    "status": "maturing",
    "volumeLiters": 10350,
    "origin": "Parcelle demo 10",
    "createdAt": "2026-05-18T09:00:00.000Z",
    "updatedAt": "2026-05-18T09:00:00.000Z"
  }
]
