[
  {
    "id": "66666666-6666-4666-8666-666666666666",
    "siteId": "11111111-1111-4111-8111-111111111111",
    "code": "LOT-2026-001",
    "productType": "cidre",
    "variety": "Douce Moen",
    "harvestYear": 2025,
    "status": "maturing",
    "volumeLiters": 9200,
    "origin": "Vergers partenaires",
    "createdAt": "2026-05-18T09:00:00.000Z",
    "updatedAt": "2026-05-18T09:00:00.000Z"
  }
]

